"Name.of.Covered.Entity","State","Covered.Entity.Type","Individuals.Affected","Breach.Submission.Date","Type.of.Breach","Location.of.Breached.Information"
"California Correctional Health Care Services","CA","Healthcare Provider",400000,2016-05-15,"Theft","Laptop"
"Imperial Valley Family Care Medical Group, APC","CA","Healthcare Provider",649,2016-05-13,"Theft","Laptop"
"Pulaski County Special School District-Employee Benefits Division","AR","Health Plan",2602,2016-05-12,"Unauthorized Access/Disclosure","Email"
"Medical Colleagues of Texas, LLP ","TX","Healthcare Provider",68631,2016-05-11,"Hacking/IT Incident","Network Server"
"Northwest Oncology & Hematology, S.C. ","IL","Healthcare Provider",1625,2016-05-11,"Unauthorized Access/Disclosure","Email"
"Family Medicine of Weston","FL","Healthcare Provider",500,2016-05-11,"Hacking/IT Incident","Network Server"
"HeartCare Consultants","FL","Healthcare Provider",16000,2016-05-11,"Hacking/IT Incident","Electronic Medical Record"
"UnityPoint Health Affiliated Covered Entity","IA","Healthcare Provider",1620,2016-05-11,"Unauthorized Access/Disclosure","Electronic Medical Record"
"Lafayette Pain Care PC","IN","Healthcare Provider",7500,2016-05-09,"Hacking/IT Incident","Network Server"
"Southeast Eye Institute, P.A. dba eye Associates of Pinellas","FL","Healthcare Provider",87314,2016-05-05,"Hacking/IT Incident","Network Server"
"UnitedHealth Group Single Affiliated Covered Entity (SACE)","MN","Health Plan",5330,2016-05-04,"Unauthorized Access/Disclosure","Paper/Films"
"Florida Medical Clinic, PA","FL","Healthcare Provider",1000,2016-05-04,"Unauthorized Access/Disclosure","Electronic Medical Record"
"Managed Health Services","IN","Health Plan",610,2016-05-01,"Unauthorized Access/Disclosure","Paper/Films"
"PruittHealth Home Health -- Low Country","SC","Healthcare Provider",1500,2016-04-29,"Unauthorized Access/Disclosure","Paper/Films"
"Northstar Healthcare Acquisitions LLC","TX","Healthcare Provider",19898,2016-04-28,"Theft","Laptop"
"Family & Children's Services of Mid Michigan, Inc.","MI","Healthcare Provider",981,2016-04-27,"Hacking/IT Incident","Network Server"
"Comanche County Hospital Authority","OK","Healthcare Provider",2199,2016-04-25,"Hacking/IT Incident","Email"
"Children's National Medical Center","DC","Healthcare Provider",4107,2016-04-25,"Unauthorized Access/Disclosure","Network Server"
"Mayfield Clinic Inc","OH","Healthcare Provider",23341,2016-04-23,"Hacking/IT Incident","Email"
"Ohio Department of Mental Health and Addiction Services","OH","Healthcare Provider",59000,2016-04-22,"Unauthorized Access/Disclosure","Paper/Films"
"Edwin Shaw Rehabilitation","OH","Healthcare Provider",975,2016-04-22,"Loss","Other"
"Wyoming Medical Center","WY","Healthcare Provider",3184,2016-04-20,"Hacking/IT Incident","Email"
"Lake Pulmonary Critical PA","FL","Healthcare Provider",648,2016-04-20,"Theft","Paper/Films"
"Lake Pulmonary Critical Care PA","FL","Healthcare Provider",648,2016-04-20,"Theft","Paper/Films"
"Florida Hospital Medical Group","FL","Healthcare Provider",1906,2016-04-18,"Unauthorized Access/Disclosure","Email"
"Vail Clinic, Inc. dba Vail Valley Medical Center, and dba Howard Head Sports Medicine","CO","Healthcare Provider",3118,2016-04-15,"Unauthorized Access/Disclosure","Laptop, Network Server"
"Atique Orthodontics","OR","Healthcare Provider",1506,2016-04-15,"Hacking/IT Incident","Desktop Computer"
"Oneida Tribe of Indians of Wisconsin","WI","Healthcare Provider",2734,2016-04-15,"Theft","Desktop Computer, Other Portable Electronic Device"
"Florida Department of Health","FL","Healthcare Provider",1076,2016-04-13,"Unauthorized Access/Disclosure","Paper/Films"
"American Fidelity Assurance Company","OK","Health Plan",2664,2016-04-13,"Unauthorized Access/Disclosure","Paper/Films"
"United Community & Family Services","CT","Healthcare Provider",1000,2016-04-12,"Unauthorized Access/Disclosure","Email"
"OptumRx, Inc.","CA","Healthcare Provider",6229,2016-04-12,"Theft","Laptop"
"Sacred Heart Health System, Inc","FL","Healthcare Provider",532,2016-04-12,"Unauthorized Access/Disclosure","Other"
"Mark Anthony Quintero, M.D., L.L.C.","FL","Healthcare Provider",650,2016-04-12,"Hacking/IT Incident","Network Server"
"Pain Treatment Centers of America ","AR","Healthcare Provider",19397,2016-04-11,"Hacking/IT Incident","Electronic Medical Record, Network Server"
"BioReference Laboratories, Inc","NJ","Healthcare Provider",3563,2016-04-08,"Unauthorized Access/Disclosure","Other"
"Indian Health Service Northern Navajo Medical Center","NM","Health Plan",7421,2016-04-07,"Theft","Paper/Films"
"RMA Medical Centers of Florida","FL","Healthcare Provider",3906,2016-04-07,"Theft","Laptop"
"Einstein Healthcare Network ","PA","Healthcare Provider",2939,2016-04-01,"Unauthorized Access/Disclosure","Other"
"Pointe Medical Services, Inc.","FL","Healthcare Provider",2000,2016-04-01,"Theft","Desktop Computer, Other Portable Electronic Device"
"Aurora Health Care, Inc.","WI","Healthcare Provider",869,2016-04-01,"Unauthorized Access/Disclosure","Network Server"
"Mercy Iowa City","IA","Healthcare Provider",15625,2016-03-25,"Hacking/IT Incident","Desktop Computer, Email, Network Server"
"Morton Medical Center, PLLC","WA","Healthcare Provider",3000,2016-03-24,"Hacking/IT Incident","Desktop Computer, Network Server"
"Excel Plus Home Health, Incorporated","TX","Healthcare Provider",524,2016-03-23,"Theft","Desktop Computer"
"National Counseling Group","VA","Healthcare Provider",23000,2016-03-21,"Hacking/IT Incident","Email"
"Bozeman Health Deaconess Hospital","MT","Healthcare Provider",1124,2016-03-21,"Unauthorized Access/Disclosure","Paper/Films"
"Val Verde Regional Medical Center","TX","Healthcare Provider",2000,2016-03-18,"Hacking/IT Incident","Desktop Computer, Electronic Medical Record, Email, Laptop, Network Server"
"Lindsay House Surgery Center, LLC","NY","Healthcare Provider",773,2016-03-18,"Theft","Paper/Films"
"Hospital for Special Surgery","NY","Healthcare Provider",647,2016-03-17,"Unauthorized Access/Disclosure","Email"
"W. Christopher Bryant DDS PC","MI","Healthcare Provider",2200,2016-03-17,"Loss","Other Portable Electronic Device"
"Laborers Funds Administrative Office of Northern California, Inc.","CA","Health Plan",2373,2016-03-15,"Unauthorized Access/Disclosure","Paper/Films"
"JASACare","NY","Healthcare Provider",1154,2016-03-14,"Hacking/IT Incident","Email"
"Vibrant Body Wellness","CA","Healthcare Provider",726,2016-03-11,"Theft","Laptop, Other Portable Electronic Device"
"Virtua Medical Group","NJ","Healthcare Provider",1654,2016-03-11,"Unauthorized Access/Disclosure","Network Server, Other"
"Karmanos Cancer Center","MI","Healthcare Provider",2808,2016-03-10,"Loss","Other Portable Electronic Device"
"UHHS Geauga Medical Center","OH","Healthcare Provider",677,2016-03-10,"Unauthorized Access/Disclosure","Electronic Medical Record"
"Vidant Health","NC","Healthcare Provider",897,2016-03-10,"Unauthorized Access/Disclosure","Other"
"Cromwell Fire District","CT","Healthcare Provider",500,2016-03-10,"Unauthorized Access/Disclosure","Paper/Films"
"Illinois Valley Podiatry Group","IL","Healthcare Provider",26588,2016-03-08,"Hacking/IT Incident","Electronic Medical Record, Network Server"
"Complete Family Foot Care","NE","Healthcare Provider",5883,2016-03-07,"Hacking/IT Incident","Electronic Medical Record, Network Server"
"Walgreen Co.","IL","Healthcare Provider",880,2016-03-04,"Theft","Paper/Films"
"Premier Healthcare, LLC","IN","Healthcare Provider",205748,2016-03-04,"Theft","Laptop"
"Cardiology Associates of Jonesboro, Inc.","AR","Healthcare Provider",1669,2016-03-04,"Unauthorized Access/Disclosure","Paper/Films"
"21st Century Oncology","FL","Healthcare Provider",2213597,2016-03-04,"Hacking/IT Incident","Network Server"
"City of Hope","CA","Healthcare Provider",1024,2016-03-04,"Hacking/IT Incident","Email"
"Centers Plan for Healthy Living ","NY","Health Plan",6893,2016-03-03,"Theft","Laptop"
"Walmart Stores, Inc.","AR","Healthcare Provider",4800,2016-03-01,"Unauthorized Access/Disclosure","Electronic Medical Record"
"Group Life Hospital and Medical Program","CT","Health Plan",3000,2016-02-29,"Hacking/IT Incident","Network Server"
"Mind Springs Health","CO","Healthcare Provider",2147,2016-02-27,"Unauthorized Access/Disclosure","Network Server"
"Eye Institute of Corpus Christi","TX","Healthcare Provider",43961,2016-02-26,"Theft","Electronic Medical Record"
"Freeport Memorial Hospital","IL","Healthcare Provider",1349,2016-02-26,"Theft","Other"
"Ecolab Health and Welfare Benefits Plan","MN","Health Plan",1550,2016-02-26,"Hacking/IT Incident","Network Server"
"Ecolab Health and Welfare Benefits Plan","MN","Health Plan",1550,2016-02-26,"Hacking/IT Incident","Network Server"
"Nintendo of America Inc.","WA","Health Plan",6248,2016-02-26,"Hacking/IT Incident","Network Server"
"Valley Hope Association ","KS","Healthcare Provider",52076,2016-02-26,"Theft","Laptop"
"Vancouver Radiologists, PC","WA","Healthcare Provider",603,2016-02-26,"Unauthorized Access/Disclosure","Paper/Films"
"Locust Fork Pharmacy","AL","Healthcare Provider",5000,2016-02-26,"Unauthorized Access/Disclosure","Other"
"BJC HealthCare ACO, LLC","MO","Healthcare Provider",2393,2016-02-26,"Unauthorized Access/Disclosure","Email"
"ELLIOT J MARTIN CHIROPRACTIC PC","NY","Healthcare Provider",1200,2016-02-24,"Hacking/IT Incident","Desktop Computer"
"Roark's Pharmacy","TN","Healthcare Provider",3000,2016-02-19,"Theft","Network Server"
"Public Health Trust of Miami-Dade County, Florida","FL","Healthcare Provider",24188,2016-02-19,"Unauthorized Access/Disclosure","Electronic Medical Record"
"Alliance Health Networks, LLC","UT","Healthcare Provider",42372,2016-02-15,"Hacking/IT Incident","Network Server"
"Radiology Regional Center, PA","FL","Healthcare Provider",483063,2016-02-12,"Loss","Paper/Films"
"Washington State Health Care Authority (HCA)","WA","Health Plan",91187,2016-02-09,"Unauthorized Access/Disclosure","Email"
"Borgess Medical Center d/b/a Borgess Rheumatology","MI","Healthcare Provider",700,2016-02-05,"Unauthorized Access/Disclosure","Paper/Films"
"Rite Aid Store 01617","NY","Healthcare Provider",976,2016-02-03,"Unauthorized Access/Disclosure","Desktop Computer, Other"
"Grx Holdings, LLC dba Medicap Pharmacy","IA","Healthcare Provider",2300,2016-02-02,"Loss","Other"
"Louisiana Healthcare Connections","LA","Health Plan",13086,2016-02-02,"Theft","Other"
"Crown Point Health Center","IN","Healthcare Provider",1854,2016-01-29,"Improper Disposal","Paper/Films"
"Community Mercy Health Partners","OH","Healthcare Provider",113528,2016-01-25,"Improper Disposal","Paper/Films"
"Livongo Health, Inc.","IL","Healthcare Provider",1950,2016-01-25,"Unauthorized Access/Disclosure","Paper/Films"
"The University of Texas System Administration","TX","Health Plan",794,2016-01-21,"Unauthorized Access/Disclosure","Email"
"New West Health Services d/b/a New West Medicare ","MT","Health Plan",28209,2016-01-15,"Loss","Laptop"
"Hawai‘i Medical Service Association","HI","Health Plan",10179,2016-01-15,"Unauthorized Access/Disclosure","Paper/Films"
"CDC/NIOSH/ World Trade Center Health Program (WTCHP)","GA","Health Plan",597,2016-01-15,"Unauthorized Access/Disclosure","Paper/Films"
"Blue Shield of California","CA","Health Plan",20764,2016-01-14,"Unauthorized Access/Disclosure","Network Server"
"Felicia Lewis, MD Lakewood Hills Internal Medicine","TX","Healthcare Provider",1500,2016-01-14,"Hacking/IT Incident","Electronic Medical Record"
"G&S Medical Associates, LLC","NJ","Healthcare Provider",3000,2016-01-14,"Hacking/IT Incident","Desktop Computer"
"Brigham and Women's Hospital","MA","Healthcare Provider",1009,2016-01-11,"Hacking/IT Incident","Email"
"AHRC Nassau ","NY","Healthcare Provider",1200,2016-01-06,"Unauthorized Access/Disclosure","Paper/Films"
"Elite Imaging","FL","Healthcare Provider",1457,2016-01-04,"Theft","Paper/Films"
"Pittman Family Dental","OH","Healthcare Provider",8830,2015-12-31,"Hacking/IT Incident","Network Server"
"St. Luke's Cornwall Hospital","NY","Healthcare Provider",29156,2015-12-30,"Theft","Other Portable Electronic Device"
"Hillsides","CA","Healthcare Provider",502,2015-12-30,"Unauthorized Access/Disclosure","Email"
"Michael Benjamin, M.D., Inc.","CA","Healthcare Provider",1300,2015-12-28,"Theft","Paper/Films"
"HealthSouth Rehabilitation Hospital of Round Rock","TX","Healthcare Provider",1359,2015-12-24,"Theft","Laptop"
"ST Psychotherapy, LLC","WI","Healthcare Provider",509,2015-12-23,"Theft","Laptop"
"Allina Health","MN","Healthcare Provider",6195,2015-12-23,"Improper Disposal","Paper/Films"
"WhiteGlove Health","TX","Healthcare Provider",975,2015-12-23,"Unauthorized Access/Disclosure","Email"
"Oceans Acquisition, Inc.","TX","Healthcare Provider",659,2015-12-22,"Theft","Laptop"
"Belgrade Regional Health Center","ME","Healthcare Provider",854,2015-12-18,"Unauthorized Access/Disclosure","Paper/Films"
"Physicians Health Plan of Northern Indiana, Inc.","IN","Health Plan",1708,2015-12-18,"Unauthorized Access/Disclosure","Paper/Films"
"Fidelis Care ","NY","Health Plan",738,2015-12-15,"Unauthorized Access/Disclosure","Paper/Films"
"Fidelis Care ","NY","Health Plan",687,2015-12-15,"Unauthorized Access/Disclosure","Paper/Films"
"New Mexico Department of Health","NM","Healthcare Provider",561,2015-12-15,"Theft","Laptop"
"Northwest Primary Care Group","OR","Healthcare Provider",5327,2015-12-11,"Theft","Desktop Computer, Paper/Films"
"Mary Ruth Buchness, MD, Dermatologist, P.C.","NY","Healthcare Provider",14910,2015-12-11,"Unauthorized Access/Disclosure","Email"
"Maine General Health","ME","Healthcare Provider",500,2015-12-08,"Hacking/IT Incident","Network Server"
"Middlesex Hospital","CT","Healthcare Provider",946,2015-12-04,"Hacking/IT Incident","Email"
"Camelback Women's Health","AZ","Healthcare Provider",810,2015-12-03,"Unauthorized Access/Disclosure","Paper/Films"
"Blue Cross and Blue Shield of Nebraska","NE","Health Plan",1872,2015-12-03,"Unauthorized Access/Disclosure","Paper/Films"
"University of Colorado Health","CO","Healthcare Provider",827,2015-12-02,"Unauthorized Access/Disclosure","Electronic Medical Record"
"Cottage Health","CA","Healthcare Provider",11000,2015-12-01,"Unauthorized Access/Disclosure","Network Server"
"Centegra Health System ","IL","Healthcare Provider",2929,2015-12-01,"Unauthorized Access/Disclosure","Paper/Films"
"PeaceHealth","WA","Healthcare Provider",1407,2015-11-30,"Unauthorized Access/Disclosure","Other"
"Carolyn B Lyde, MD, PA","TX","Healthcare Provider",1500,2015-11-30,"Theft","Laptop"
"New Dimension Group, LLC","NC","Healthcare Provider",1275,2015-11-25,"Loss","Other Portable Electronic Device"
"Pathways Professional Counseling","AL","Healthcare Provider",986,2015-11-24,"Theft","Laptop"
"Cigna Home Delivery Pharmacy","CT","Healthcare Provider",592,2015-11-23,"Unauthorized Access/Disclosure","Paper/Films"
"Alaska Orthopedic Specialists, Inc.","AK","Healthcare Provider",553,2015-11-19,"Theft","Email"
"UC Health, LLC","OH","Healthcare Provider",1064,2015-11-14,"Unauthorized Access/Disclosure","Email"
"Midlands Orthopaedics, P.A. ","SC","Healthcare Provider",3902,2015-11-13,"Hacking/IT Incident","Network Server"
"HealthPoint","WA","Healthcare Provider",1300,2015-11-13,"Theft","Laptop"
"OH Muhlenberg, LLC ","KY","Healthcare Provider",84681,2015-11-13,"Hacking/IT Incident","Desktop Computer, Email, Laptop, Network Server, Other Portable Electronic Device"
"North Carolina Department of Health and Human Services","NC","Health Plan",524,2015-11-13,"Unauthorized Access/Disclosure","Email"
"Good Care Pediatric, LLP","NY","Healthcare Provider",2300,2015-11-12,"Hacking/IT Incident","Desktop Computer"
"Dean Health Plan","WI","Health Plan",960,2015-11-11,"Loss","Paper/Films"
"Rush University Medical Center","IL","Healthcare Provider",1529,2015-11-06,"Unauthorized Access/Disclosure","Paper/Films"
"LTC Dental, P.C.","AL","Healthcare Provider",1680,2015-10-28,"Theft","Laptop"
"Children's Medical Clinics of East Texas","TX","Healthcare Provider",16000,2015-10-28,"Unauthorized Access/Disclosure","Desktop Computer"
"Bon Secours Saint Francis ","SC","Healthcare Provider",1997,2015-10-26,"Unauthorized Access/Disclosure","Electronic Medical Record"
"Florida Department of Health, Children's Medical Services","FL","Healthcare Provider",500,2015-10-23,"Unauthorized Access/Disclosure","Paper/Films"
"Indian Territory Home Health and Hospice","OK","Healthcare Provider",4500,2015-10-22,"Hacking/IT Incident","Email"
"Huntington Medical Research Institutes","CA","Healthcare Provider",4300,2015-10-20,"Unauthorized Access/Disclosure","Laptop, Other Portable Electronic Device"
"OsteoMed LP","TX","Health Plan",1134,2015-10-20,"Theft","Other"
"North Carolina Department of Health and Human Services","NC","Health Plan",1615,2015-10-19,"Hacking/IT Incident","Email"
"BeHealthy Florida, Inc.","FL","Health Plan",835,2015-10-19,"Unauthorized Access/Disclosure","Paper/Films"
" Woodhull Medical and Mental Health Center ","NY","Healthcare Provider",1581,2015-10-19,"Theft","Laptop"
"Emergence Health Network","TX","Healthcare Provider",11100,2015-10-16,"Hacking/IT Incident","Network Server"
"Nephropathology Associates, PLC","AR","Healthcare Provider",1260,2015-10-16,"Unauthorized Access/Disclosure","Email"
"Centene Management Corporation","MO","Health Plan",8208,2015-10-15,"Theft","Other Portable Electronic Device"
"University of Oklahoma Department of Urology","OK","Healthcare Provider",9300,2015-10-10,"Theft","Laptop"
"SSM Health Cancer Care","MO","Healthcare Provider",643,2015-10-09,"Unauthorized Access/Disclosure","Paper/Films"
"The Johns Hopkins Hospital","MD","Healthcare Provider",571,2015-10-09,"Theft","Laptop"
"Aspire Home Care and Hospice","OK","Healthcare Provider",4278,2015-10-09,"Hacking/IT Incident","Email"
"Anne Arundel Health System","MD","Healthcare Provider",2208,2015-10-08,"Unauthorized Access/Disclosure","Paper/Films"
"CarePlus Health Plans [case 18772]","KY","Health Plan",2873,2015-10-06,"Unauthorized Access/Disclosure","Paper/Films"
"Sentara Healthcare ","VA","Healthcare Provider",1040,2015-10-02,"Theft","Other Portable Electronic Device"
"Baptist Health and Arkansas Health Group","AR","Healthcare Provider",6500,2015-10-01,"Unauthorized Access/Disclosure","Electronic Medical Record"
"Humana Inc [Case 18652]","KY","Health Plan",2815,2015-09-30,"Theft","Laptop, Paper/Films"
"Kindred Nursing Centers West, L.L.C.","CA","Healthcare Provider",1125,2015-09-25,"Theft","Desktop Computer"
"Silverberg Surgical and Medical Group","CA","Healthcare Provider",857,2015-09-25,"Unauthorized Access/Disclosure","Network Server"
"Horizon Healthcare Services, Inc., doing business as Horizon Blue Cross Blue Shield of New Jersey, and its affiliates","NJ","Health Plan",1173,2015-09-24,"Unauthorized Access/Disclosure","Electronic Medical Record, Other"
"Barrington Orthopedic Specialists, Ltd","IL","Healthcare Provider",1009,2015-09-24,"Theft","Laptop, Other"
"Skin and Cancer Center of Arizona","AZ","Healthcare Provider",3311,2015-09-21,"Unauthorized Access/Disclosure","Paper/Films"
"Heartland Health Clinic","VA","Healthcare Provider",3650,2015-09-21,"Hacking/IT Incident","Desktop Computer, Electronic Medical Record, Network Server"
"Molina Healthcare","CA","Health Plan",54203,2015-09-18,"Theft","Desktop Computer"
"Health Care Service Corporation","IL","Health Plan",501,2015-09-17,"Theft","Paper/Films"
"Daniel A. Sheldon, M.D., P.A.","FL","Healthcare Provider",2075,2015-09-16,"Hacking/IT Incident","Network Server"
"Louisiana State University Health Sciences Center-New Orleans","LA","Healthcare Provider",14500,2015-09-15,"Theft","Laptop"
"Affinity Health Plan, Inc.","NY","Health Plan",721,2015-09-14,"Unauthorized Access/Disclosure","Paper/Films"
"Sutter Medical Foundation","CA","Healthcare Provider",2302,2015-09-11,"Unauthorized Access/Disclosure","Email"
"Blue Cross Blue Shield of North Carolina","NC","Health Plan",1530,2015-09-11,"Unauthorized Access/Disclosure","Paper/Films"
"Blue Cross Blue Shield of North Carolina","NC","Health Plan",807,2015-09-11,"Unauthorized Access/Disclosure","Paper/Films"
"Excellus Health Plan, Inc.","NY","Health Plan",9358891,2015-09-09,"Hacking/IT Incident","Network Server"
"Oakland Family Services","MI","Healthcare Provider",16107,2015-09-09,"Hacking/IT Incident","Email"
"Lee Memorial Health System","FL","Healthcare Provider",1508,2015-09-07,"Unauthorized Access/Disclosure","Paper/Films"
"University of California, Los Angeles Health","CA","Healthcare Provider",1242,2015-09-01,"Theft","Laptop"
"Minneapolis Clinic of Neurology, Ltd.","MN","Healthcare Provider",1450,2015-08-31,"Theft","Laptop"
"Metropolitan Atlanta Rapid Transit Authority","GA","Health Plan",800,2015-08-27,"Unauthorized Access/Disclosure","Paper/Films"
"Merit Health Northwest Mississippi","MS","Healthcare Provider",846,2015-08-26,"Theft","Electronic Medical Record"
"ROBERT SOPER, M.D.","CA","Healthcare Provider",2000,2015-08-26,"Theft","Desktop Computer"
"Children's Hospital Medical Center of Akron","OH","Healthcare Provider",7664,2015-08-26,"Loss","Other Portable Electronic Device"
"Lancaster Cardiology Medical Group, and Sunder Heart Institute and Vascular Medical Clinic","CA","Healthcare Provider",1200,2015-08-24,"Theft","Desktop Computer, Laptop, Network Server, Other Portable Electronic Device"
"Pediatric Gastroenterology, Hepatology & Nutrition of Florida, P.A.","FL","Healthcare Provider",13000,2015-08-24,"Theft","Paper/Films"
"PT Northwest, LLC","OR","Healthcare Provider",1500,2015-08-21,"Unauthorized Access/Disclosure","Email"
"Pediatric Group LLC","IL","Healthcare Provider",10000,2015-08-21,"Hacking/IT Incident","Network Server"
"Empi Inc and DJO, LLC","MN","Healthcare Provider",160000,2015-08-20,"Theft","Laptop"
"Colorado Department of Health Care Policy and Financing","CO","Health Plan",1622,2015-08-18,"Unauthorized Access/Disclosure","Paper/Films"
"Cancer Care Northwest","WA","Healthcare Provider",1426,2015-08-17,"Loss","Paper/Films"
"Endocrinology Associates, Inc.","OH","Healthcare Provider",1400,2015-08-14,"Unauthorized Access/Disclosure","Other"
"Walgreen Co.","IL","Healthcare Provider",8345,2015-08-07,"Unauthorized Access/Disclosure","Paper/Films"
"Baylor College of Medicine","TX","Healthcare Provider",1004,2015-08-07,"Theft","Other Portable Electronic Device, Paper/Films"
"Max M Bayard MD, PC","VT","Healthcare Provider",2000,2015-08-07,"Theft","Laptop, Other Portable Electronic Device"
"T.J. Samson Community Hospital","KY","Healthcare Provider",2060,2015-08-07,"Unauthorized Access/Disclosure","Email"
"Lawrence General Hospital","MA","Healthcare Provider",2071,2015-08-05,"Loss","Other Portable Electronic Device"
"VA Black Hills Health Care System","SD","Healthcare Provider",1168,2015-08-04,"Unauthorized Access/Disclosure","Paper/Films"
"Orlantino Dyoco, M.D.","CA","Healthcare Provider",9000,2015-08-03,"Theft","Desktop Computer, Laptop"
"North East Medical Services (NEMS)","CA","Healthcare Provider",69246,2015-07-31,"Theft","Laptop"
"Siouxland Anesthesiology, Ltd.","SD","Healthcare Provider",13000,2015-07-31,"Hacking/IT Incident","Network Server"
"Sioux Falls VA Health Care System","SD","Healthcare Provider",1111,2015-07-30,"Loss","Paper/Films"
"Prima CARE, PC","MA","Healthcare Provider",1651,2015-07-29,"Unauthorized Access/Disclosure","Paper/Films"
"The McLean Hospital Corporation","MA","Healthcare Provider",12673,2015-07-28,"Loss","Other Portable Electronic Device"
"OhioHealth","OH","Healthcare Provider",1006,2015-07-24,"Loss","Other Portable Electronic Device"
"Advanced Radiology Consultants, LLC","CT","Healthcare Provider",855,2015-07-24,"Unauthorized Access/Disclosure","Electronic Medical Record"
"Healthfirst Affiliates that include Healthfirst PHSP, Inc., Managed Health, Inc., HF Management Services, LLC, and Senior Health Partners ","NY","Health Plan",5338,2015-07-24,"Hacking/IT Incident","Electronic Medical Record"
"Urology Associates, Professional Corporation","MT","Healthcare Provider",6500,2015-07-24,"Unauthorized Access/Disclosure","Paper/Films"
"Montefiore Medical Center ","NY","Healthcare Provider",12517,2015-07-22,"Theft","Electronic Medical Record"
"Special Agents Mutual Benefit Association","MD","Health Plan",1475,2015-07-20,"Hacking/IT Incident","Network Server"
"University of California, Los Angeles Health","CA","Healthcare Provider",4500000,2015-07-17,"Hacking/IT Incident","Network Server"
"Arkansas Blue Cross and Blue Shield","AR","Health Plan",560,2015-07-14,"Theft","Desktop Computer"
"Maricopa Special  Health Care District - Maricopa Integrated Health System","AZ","Healthcare Provider",633,2015-07-14,"Loss","Other Portable Electronic Device"
"Mayo Clinic Health System- Red Wing","MN","Healthcare Provider",601,2015-07-13,"Unauthorized Access/Disclosure","Electronic Medical Record"
"Amsterdam Nursing Home Corporation (1992)","NY","Healthcare Provider",621,2015-07-10,"Loss","Paper/Films"
"Howard University","DC","Healthcare Provider",1445,2015-07-10,"Unauthorized Access/Disclosure","Paper/Films"
"Integral Health Plan, Inc.","FL","Health Plan",7549,2015-07-10,"Unauthorized Access/Disclosure","Paper/Films"
"Massachusetts General Hospital","MA","Healthcare Provider",648,2015-07-08,"Unauthorized Access/Disclosure","Email"
"Georgia Department of Human Services","GA","Health Plan",2983,2015-07-08,"Unauthorized Access/Disclosure","Email"
"FireKeepers Casino Hotel","MI","Health Plan",7666,2015-07-03,"Hacking/IT Incident","Network Server"
"University of Oklahoma, Department of Obstetrics and Gynecology","OK","Healthcare Provider",7693,2015-07-03,"Theft","Laptop"
"Orlando Health","FL","Healthcare Provider",3421,2015-07-02,"Unauthorized Access/Disclosure","Electronic Medical Record"
"UPMC Health Plan","PA","Health Plan",722,2015-07-02,"Unauthorized Access/Disclosure","Email"
"Meritus Medical Center, Inc.","MD","Healthcare Provider",1029,2015-06-26,"Unauthorized Access/Disclosure","Electronic Medical Record"
